{
  "caseId": "live_in_aide_case_undue_burden_001",
  "branch": "undue_burden_constructive_denial",
  "activeOutcome": "violation",
  "primaryKind": "memorandum_pdf",
  "recommendedFirstStop": "memorandum_of_law.pdf",
  "whyOpenThis": "Start with the printable memorandum because it is the strongest branch-aligned narrative for undue_burden_constructive_denial review.",
  "authorityTrust": {
    "authorityCount": 5,
    "verifiedQuoteCount": 4,
    "paraphraseCount": 1,
    "missingCount": 0,
    "severity": "warning",
    "label": "mixed_support",
    "advisory": "This case mixes verified quotes with paraphrase support, so downstream consumers should distinguish direct support from fallback grounding."
  },
  "sourceSummary": {
    "authorityCount": 5,
    "sourceVerifiedCount": 5,
    "sourceNormalizedCount": 5,
    "fullySourceVerified": true,
    "fullySourceNormalized": true,
    "sourceStatus": "All authority entries are sourceVerified and sourceNormalized."
  },
  "fitSummary": {
    "authorityCount": 5,
    "directCount": 3,
    "analogicalCount": 2,
    "recordSupportCount": 0,
    "fitStatus": "This package includes analogical authority mappings."
  },
  "fitFindingSummary": {
    "hasFitFinding": true,
    "fitFinding": "analogical_support",
    "fitFindingNote": "This package includes analogical mappings, so the legal fit should be described as mixed direct and analogical support."
  },
  "warningSummary": {
    "hasWarnings": true,
    "warningEntryCount": 16,
    "warningCounts": {
      "mixed_support": 16
    }
  },
  "warningLabelSummary": {
    "hasWarningLabel": true,
    "warningLabel": "mixed_support",
    "warningEntryCount": 16
  },
  "entries": [
    {
      "kind": "summary",
      "path": "summary.json",
      "format": "json",
      "description": "Compact branch-aware summary for downstream tooling.",
      "priority": 3,
      "priorityLabel": "secondary",
      "whyOpenThis": "Open this when you want the quickest branch-aware orientation for undue_burden_constructive_denial review.",
      "trustWarning": {
        "severity": "warning",
        "label": "mixed_support",
        "message": "This case mixes verified quotes with paraphrase support, so downstream consumers should distinguish direct support from fallback grounding."
      }
    },
    {
      "kind": "result",
      "path": "../live_in_aide_case_undue_burden_001.result.json",
      "format": "json",
      "description": "Full evaluator output with findings, explanations, and provenance.",
      "priority": 4,
      "priorityLabel": "supporting",
      "whyOpenThis": "Open this when you want the full evaluator output with resolved facts, explanations, and provenance.",
      "trustWarning": {
        "severity": "warning",
        "label": "mixed_support",
        "message": "This case mixes verified quotes with paraphrase support, so downstream consumers should distinguish direct support from fallback grounding."
      }
    },
    {
      "kind": "advocacy_bundle",
      "path": "advocacy_bundle.json",
      "format": "json",
      "description": "Structured advocacy citations and drafting metadata.",
      "priority": 5,
      "priorityLabel": "supporting",
      "whyOpenThis": "Open this when you want the structured drafting and citation payload that drives the advocacy outputs.",
      "trustWarning": {
        "severity": "warning",
        "label": "mixed_support",
        "message": "This case mixes verified quotes with paraphrase support, so downstream consumers should distinguish direct support from fallback grounding."
      }
    },
    {
      "kind": "hearing_script_markdown",
      "path": "hearing_script.md",
      "format": "markdown",
      "description": "Hearing script draft grounded in the evaluated case state.",
      "priority": 8,
      "priorityLabel": "supporting",
      "whyOpenThis": "Open this when you want the hearing-oriented draft rather than the fuller memorandum package.",
      "trustWarning": {
        "severity": "warning",
        "label": "mixed_support",
        "message": "This case mixes verified quotes with paraphrase support, so downstream consumers should distinguish direct support from fallback grounding."
      }
    },
    {
      "kind": "complaint_outline_markdown",
      "path": "complaint_outline.md",
      "format": "markdown",
      "description": "Complaint outline draft for the current branch posture.",
      "priority": 9,
      "priorityLabel": "supporting",
      "whyOpenThis": "Open this when you want the complaint framing and issue outline instead of prose briefing.",
      "trustWarning": {
        "severity": "warning",
        "label": "mixed_support",
        "message": "This case mixes verified quotes with paraphrase support, so downstream consumers should distinguish direct support from fallback grounding."
      }
    },
    {
      "kind": "demand_letter_markdown",
      "path": "demand_letter.md",
      "format": "markdown",
      "description": "Demand-letter draft for the current branch posture.",
      "priority": 6,
      "priorityLabel": "supporting",
      "whyOpenThis": "Open this when you want the demand-letter posture and requested remedy framing.",
      "trustWarning": {
        "severity": "warning",
        "label": "mixed_support",
        "message": "This case mixes verified quotes with paraphrase support, so downstream consumers should distinguish direct support from fallback grounding."
      }
    },
    {
      "kind": "negotiation_summary_markdown",
      "path": "negotiation_summary.md",
      "format": "markdown",
      "description": "Negotiation summary draft with branch-aware leverage framing.",
      "priority": 7,
      "priorityLabel": "supporting",
      "whyOpenThis": "Open this when you want the shortest negotiation-oriented leverage summary.",
      "trustWarning": {
        "severity": "warning",
        "label": "mixed_support",
        "message": "This case mixes verified quotes with paraphrase support, so downstream consumers should distinguish direct support from fallback grounding."
      }
    },
    {
      "kind": "memorandum_json",
      "path": "memorandum.json",
      "format": "json",
      "description": "Structured memorandum sections with citation rollups and paragraph support.",
      "priority": 11,
      "priorityLabel": "supporting",
      "whyOpenThis": "Open this when you want the structured memorandum bundle for downstream tooling instead of the human-readable draft.",
      "trustWarning": {
        "severity": "warning",
        "label": "mixed_support",
        "message": "This case mixes verified quotes with paraphrase support, so downstream consumers should distinguish direct support from fallback grounding."
      }
    },
    {
      "kind": "memorandum_markdown",
      "path": "memorandum.md",
      "format": "markdown",
      "description": "Human-readable memorandum with visible section and paragraph support blocks.",
      "priority": 2,
      "priorityLabel": "secondary",
      "whyOpenThis": "Open this when you want the editable human-readable memorandum draft.",
      "trustWarning": {
        "severity": "warning",
        "label": "mixed_support",
        "message": "This case mixes verified quotes with paraphrase support, so downstream consumers should distinguish direct support from fallback grounding."
      }
    },
    {
      "kind": "memorandum_pdf",
      "path": "memorandum_of_law.pdf",
      "format": "pdf",
      "description": "Printable memorandum of law with paragraph-level support lines.",
      "priority": 1,
      "priorityLabel": "primary",
      "whyOpenThis": "Start with the printable memorandum because it is the strongest branch-aligned narrative for undue_burden_constructive_denial review.",
      "trustWarning": {
        "severity": "warning",
        "label": "mixed_support",
        "message": "This case mixes verified quotes with paraphrase support, so downstream consumers should distinguish direct support from fallback grounding."
      }
    },
    {
      "kind": "dependency_graph",
      "path": "dependency_graph.json",
      "format": "json",
      "description": "Dependency graph nodes and edges for the active reasoning branch.",
      "priority": 10,
      "priorityLabel": "supporting",
      "whyOpenThis": "Open this when you want the reasoning graph behind the active branch analysis.",
      "trustWarning": {
        "severity": "warning",
        "label": "mixed_support",
        "message": "This case mixes verified quotes with paraphrase support, so downstream consumers should distinguish direct support from fallback grounding."
      }
    },
    {
      "kind": "dependency_citations",
      "path": "dependency_citations.jsonld",
      "format": "jsonld",
      "description": "JSON-LD grounding that links dependency targets to authority excerpts.",
      "priority": 12,
      "priorityLabel": "supporting",
      "whyOpenThis": "Open this when you want the JSON-LD grounding that links dependency targets to authority excerpts.",
      "trustWarning": {
        "severity": "warning",
        "label": "mixed_support",
        "message": "This case mixes verified quotes with paraphrase support, so downstream consumers should distinguish direct support from fallback grounding."
      }
    },
    {
      "kind": "authority_review",
      "path": "authority_review.json",
      "format": "json",
      "description": "Audit view of authority excerpts, propositions, source URLs, and support status.",
      "priority": 13,
      "priorityLabel": "supporting",
      "whyOpenThis": "Open this when you want the authority audit view with support status, excerpts, and source metadata.",
      "trustWarning": {
        "severity": "warning",
        "label": "mixed_support",
        "message": "This case mixes verified quotes with paraphrase support, so downstream consumers should distinguish direct support from fallback grounding."
      }
    },
    {